<?xml version="1.0" encoding="UTF-8"?>
<BindingOption xmlns:xsi="http://www.w3.org/2001/XMLSchema-instance"
 xsi:noNamespaceSchemaLocation="file:/C:/Users/youngseo/Desktop/BindingFormat.xsd">
    <MotionBinding>
        <repeat>0</repeat>
        <duration>0</duration>
        <goback>goback0</goback>
        <direction>direction0</direction>
    </MotionBinding>
    <TextBinding>
        <lower_limit>0</lower_limit>
        <upper_limit>0</upper_limit>
    </TextBinding>
</BindingOption>
